{
  "version": "2.0.0",
  "computed_at_iso": "2026-07-22T00:00:00Z",
  "proxy_data_provenance": {
    "qcew_vintage": "2024",
    "natural_earth_version": "5.1.2",
    "election_source": "MIT_ELECTION_LAB",
    "election_year": 2024
  },
  "edges": [
    {
      "faction_id": "FAC_WORKERS_CONGRESS",
      "territory_id": "26099",
      "influence_level": 0.2669,
      "support_type": "labor",
      "cadre_count": 12,
      "sympathizer_count": 126,
      "established_tick": 0
    },
    {
      "faction_id": "FAC_DECOLONIAL",
      "territory_id": "26099",
      "influence_level": 0.0231,
      "support_type": "ideological",
      "cadre_count": 1,
      "sympathizer_count": 11,
      "established_tick": 0
    },
    {
      "faction_id": "FAC_RESTORATIONIST",
      "territory_id": "26099",
      "influence_level": 0.5591,
      "support_type": "electoral",
      "cadre_count": 24,
      "sympathizer_count": 239,
      "established_tick": 0
    },
    {
      "faction_id": "FAC_LIBERAL_IMPERIAL",
      "territory_id": "26099",
      "influence_level": 0.1509,
      "support_type": "ideological",
      "cadre_count": 7,
      "sympathizer_count": 62,
      "established_tick": 0
    },
    {
      "faction_id": "FAC_WORKERS_CONGRESS",
      "territory_id": "26125",
      "influence_level": 0.1841,
      "support_type": "labor",
      "cadre_count": 8,
      "sympathizer_count": 91,
      "established_tick": 0
    },
    {
      "faction_id": "FAC_DECOLONIAL",
      "territory_id": "26125",
      "influence_level": 0.0193,
      "support_type": "ideological",
      "cadre_count": 1,
      "sympathizer_count": 9,
      "established_tick": 0
    },
    {
      "faction_id": "FAC_RESTORATIONIST",
      "territory_id": "26125",
      "influence_level": 0.4375,
      "support_type": "electoral",
      "cadre_count": 22,
      "sympathizer_count": 189,
      "established_tick": 0
    },
    {
      "faction_id": "FAC_LIBERAL_IMPERIAL",
      "territory_id": "26125",
      "influence_level": 0.3591,
      "support_type": "ideological",
      "cadre_count": 14,
      "sympathizer_count": 156,
      "established_tick": 0
    },
    {
      "faction_id": "FAC_WORKERS_CONGRESS",
      "territory_id": "26163",
      "influence_level": 0.4391,
      "support_type": "labor",
      "cadre_count": 20,
      "sympathizer_count": 195,
      "established_tick": 0
    },
    {
      "faction_id": "FAC_DECOLONIAL",
      "territory_id": "26163",
      "influence_level": 0.0477,
      "support_type": "ideological",
      "cadre_count": 2,
      "sympathizer_count": 19,
      "established_tick": 0
    },
    {
      "faction_id": "FAC_RESTORATIONIST",
      "territory_id": "26163",
      "influence_level": 0.3372,
      "support_type": "electoral",
      "cadre_count": 15,
      "sympathizer_count": 158,
      "established_tick": 0
    },
    {
      "faction_id": "FAC_LIBERAL_IMPERIAL",
      "territory_id": "26163",
      "influence_level": 0.176,
      "support_type": "ideological",
      "cadre_count": 8,
      "sympathizer_count": 78,
      "established_tick": 0
    }
  ]
}
